{
  "$schema": "https://json-schema.org/draft/2020-12/schema",
  "$id": "https://agentplane.dev/schemas/blueprint-catalog-index.schema.json",
  "title": "AgentPlane Blueprint Catalog Index",
  "type": "object",
  "additionalProperties": false,
  "required": ["schema_version", "catalog_id", "name", "recipes", "packs"],
  "properties": {
    "schema_version": { "const": 1 },
    "catalog_id": { "type": "string", "minLength": 1 },
    "name": { "type": "string", "minLength": 1 },
    "description": { "type": "string" },
    "recipes": {
      "type": "array",
      "items": {
        "type": "object",
        "additionalProperties": false,
        "required": ["id", "path"],
        "properties": {
          "id": { "type": "string", "pattern": "^[a-z0-9][a-z0-9._-]*$" },
          "path": { "type": "string", "minLength": 1 }
        }
      }
    },
    "packs": {
      "type": "array",
      "items": {
        "type": "object",
        "additionalProperties": false,
        "required": ["id", "path"],
        "properties": {
          "id": { "type": "string", "pattern": "^[a-z0-9][a-z0-9._-]*$" },
          "path": { "type": "string", "minLength": 1 }
        }
      }
    }
  }
}
